<?xml version="1.0" encoding="UTF-8"?>
<test_data xmlns:xsi="http://www.w3.org/2001/XMLSchema-instance"
	xsi:noNamespaceSchemaLocation="function-extremes.xsd">
	<data>
		<count>5</count>
		<rolls>
			<roll>1</roll>
			<roll>6</roll>
			<roll>3</roll>
			<roll>3</roll>
			<roll>3</roll>
		</rolls>
		<results>
			<result>1</result>
			<result>6</result>
			<result>3</result>
			<result>3</result>
			<result>3</result>
		</results>
	</data>
	<data>
		<count>3</count>
		<rolls>
			<roll>1</roll>
			<roll>6</roll>
			<roll>3</roll>
			<roll>3</roll>
			<roll>3</roll>
		</rolls>
		<results>
			<result>1</result>
			<result>3</result>
			<result>3</result>
		</results>
	</data>
	<data>
		<count>3</count>
		<rolls>
			<roll>6</roll>
			<roll>3</roll>
			<roll>3</roll>
			<roll>3</roll>
			<roll>1</roll>
		</rolls>
		<results>
			<result>3</result>
			<result>3</result>
			<result>1</result>
		</results>
	</data>
</test_data>